"タイムスタンプ","同意しますか？ (Do you agree to the content above?)","英語力を教えてください。（What is your English ability?）","母語を教えてください。 Mother Tongue?","上の写真について与えられた語句（動詞）を用いて説明してください。(Please write a sentence of about 10 words describing the photo using the verbs given.)","上の写真について与えられた語句（動詞）を全て用いて説明してください。(Please write a sentence of about 10 words describing the photo using the verbs given.)","上の写真について与えられた語句（動詞）を用いて説明してください。(Please write a sentence of about 10 words describing the photo using the verbs given.)","上の写真について与えられた語句（動詞）を用いて説明してください。(Please write a sentence of about 10 words describing the photo using the verbs given.)","上の写真について与えられた語句（動詞）を用いて説明してください。(Please write a sentence of about 10 words describing the photo using the verbs given.)","上の写真について与えられた語句（動詞）を用いて説明してください。(Please write a sentence of about 10 words describing the photo using the verbs given.)","上の写真について与えられた語句（動詞）を全て用いて説明してください。(Please write a sentence of about 10 words describing the photo using the verbs given.)","上の写真について与えられた語句（動詞）を用いて説明してください。(Please write a sentence of about 10 words describing the photo using the verbs given.)","上の写真について与えられた語句（動詞）を用いて説明してください。(Please write a sentence of about 10 words describing the photo using the verbs given.)","上の写真について与えられた語句（動詞）を用いて説明してください。(Please write a sentence of about 10 words describing the photo using the verbs given.)"
"2021/01/22 5:06:15 午後 GMT+9","同意する (I agree)","B1","Japanese","A man standing on the board surfs on the wave.","A woman takes a picture that men sit near the river.","The man drives the red bus heading for Aldwych.","Two girls are touching two animals as a pet.","Three zebras look at me in safari.","A couple is cutting one of the three wedding cakes.","A baby looks at a teeth brash holding it.","A tennis player feels so joy holding his racket.","A girl lies on her bed holding a book with a black cat.","The airplane is just landing for the destination."
"2021/01/22 10:34:39 午後 GMT+9","同意する (I agree)","B2","Japanese","A man is surfing on the sea.","A woman is taking a picture of a bird sitting near a river.","A man is driving a red bus.","Girls pet a black goat and a white goat.","Three horses with stripe skins look be approaching to me.","A man and a woman is cutting a cake together.","A baby is holding a toothbrush and looking at it.","A man is holding  a tennis racket.","A black cat lies on the bed.","A plane is landing on the airport."
"2021/01/23 7:10:39 午前 GMT+9","同意する (I agree)","C2 / Native Speaker","English","I see a woman surfing inside the tube of a wave.","As a few people sit next to a river under a bridge, a woman takes a picture of a goose.","A man drives a red double-decker bus towards Aldwych.","Two young children seem to enjoy petting black and white lambs.","Three zebras looked forward and towards the cameras taking their pictures.","A man and woman cut a fruit cake together on their wedding day.","A baby holds a toothbrush tightly as he looks intently at the back.","A tennis player holds his tennis racket as he cries.","A young girl lies in bed petting a cat and holding a book.","A plane lands safely on a runway in the afternoon."
"2021/01/23 1:55:30 午後 GMT+9","同意する (I agree)","A2","Japanese","When the weather is sunny ，the man who is surfing is enjoying.","Two people is sitting and the woman is taking a picture .","The red bus which is riding many tourist is drove by the driver.","Two children is touching pets and looks like very enjoy.","Many zebras is look at same spot and is walking.","Many grapes ，masukattos and oranges cake is cut by a woman.","A pretty baby is holding a teeth brush and she is looking it.","A tennis player is holding a tennis raket and he is laughind.","A girl who is going to go to bed is liying with her cat.","The "
"2021/01/23 5:25:20 午後 GMT+9","同意する (I agree)","A2","Japanese","I like surf","He is sit now","Bus driver is my friend","Bluckpet and whitepet","I look zebra","Cake cut togther","He is hold tooth brashi","Title hold","She is lie","Welcom skyland"
"2021/01/24 7:18:14 午後 GMT+9","同意する (I agree)","B1","Japanese","The man wearing black aqua suits is surfing on the big wave.","The woman is taking a picture and some people sitting on the  stones.","The bus driver is driving the red two-layered bus.","The two children are touching their pets in the park.","The three zebras is walking and looking at me.","Man and Woman are cutting their celebration cake. ","The baby is holding the tooth blush and looking at it.","The tennis player is holding his blue racket.","The girl is lying on the her bed with the black cat. ","The airplane will land soon at the airport near forest."
"2021/01/25 8:04:21 午後 GMT+9","同意する (I agree)","B1","Japanese","The boy is surfing on the wave of the beautiful ocean.","The girl is taking the photo of a bird by smartphone..","The boy drives the big red bus of two stories.","The girls are petting black goat and white goat.","The three pretty and big zebras are all looking over here. ","The married couple cuts a cake with the lots of fruit on the top.","The pretty boy baby holds a blue and white tooth brush.","The tennis player holds blue tennis racket of white grip.","The pretty girl and black cat lie on the bed.","The simple white and blue plane lands on the ground."
"2021/01/29 10:12:22 午前 GMT+9","同意する (I agree)","B2","Japanese","This man is surfing.","The woman is taking picture of people who are sitting and a bird.","A bus driver is driving this red bus.","Two girls are playing with goats as if goats were their pets.","Three zebras are looking around the field.","Now is wedding ceremony, husband and wife are together cutting cakes on which fruits are.","This baby is holding and looking carefully at the tooth brush on which Disney character is. ","The tennis player is happy to win the game, holding his tennis racket.","The girl is lying on her bed with her black cat and reading a book.","The small plane is about to land."