"タイムスタンプ","同意しますか？ (Do you agree with to the content above?)","英語力を教えてください。（What is your English ability?）","母語を教えてください。 Mother Tongue?","上の写真について与えられた語句（）を用いて説明してください。(Please write a sentence of about 10 words describing the photo using the verbs given.)","上の写真について与えられた語句（動詞）を用いて説明してください。(Please write a sentence of about 10 words describing the photo using the verbs given.)","上の写真について与えられた語句（動詞）を用いて説明してください。(Please write a sentence of about 10 words describing the photo using the verbs given.)","上の写真について与えられた語句（動詞）を用いて説明してください。(Please write a sentence of about 10 words describing the photo using the verbs given.)","上の写真について与えられた語句（動詞）を全て用いて説明してください。(Please write a sentence of about 10 words describing the photo using the verbs given.)","上の写真について与えられた語句（動詞）を用いて説明してください。(Please write a sentence of about 10 words describing the photo using the verbs given.)","上の写真について与えられた語句（動詞）を用いて説明してください。(Please write a sentence of about 10 words describing the photo using the verbs given.)","上の写真について与えられた語句（動詞）を用いて説明してください。(Please write a sentence of about 10 words describing the photo using the verbs given.)","上の写真について与えられた語句（動詞）を全て用いて説明してください。(Please write a sentence of about 10 words describing the photo using the verbs given.)","上の写真について与えられた語句（動詞）を用いて説明してください。(Please write a sentence of about 10 words describing the photo using the verbs given.)"
"2021/01/22 4:51:49 午後 GMT+9","同意する (I Agree)","B2","Japanese","A guy rides on a bike.","A girl learns snow boarding.","A green train goes slowly.","An elephant is kissing a guy.","A girl smiles and holds her mouth.","A market displays variety of apples.","A guy holds a huge kite.","A dog rests on a ship.","A boy who holds a controller plays wii sports.","A telephone has been replaced with banana."
"2021/01/22 5:35:56 午後 GMT+9","同意する (I Agree)","B2","","A man is riding on the white bike.","A woman starts to learn to ski on the snow.","A green train is going on the railway.","An elephant is kissing a man with glasses on.","A girl is smiling with holding a brown baseball bat.","Many kinds of fruits are displayed on the market.","A man hold a string to float a rainbow balloon.","A black dog is sleeping on the ship.","A boy is holding a wii controller to play a video game.","A yellow banana is replaced with the telephone speaker."
"2021/01/22 11:48:36 午後 GMT+9","同意する (I Agree)","A2","Japanese","He ride bike that color is green, white and black.","The girl who wear blue down and pink pants learns ski.","The green, black and red train has gone to America.","The danbo that is only 2 years old  kiss handsome man. ","The standing girl who hold a bad is big smile.","Many variety of apple is displayed on the colorful box.   ","The man who wear write short is hold rainbow color balloon.","The dog wear hart charm is rest time unless the boat arrive the land.","The boy wears black short is hold a stack, is playing game.","The black phone lost the most important component, so replace banana.  "
"2021/01/23 5:26:48 午後 GMT+9","同意する (I Agree)","A1","Japanese","He is riding a motorcycle.","That person learn to sking.","The train going.","Elephant kissing his neck.","She is laghing who is having a bad her left hand.","This is a fruit shop.","They hold a kite on the beech.","The dog is on the boot.","That kid play exerice in front of TV.","The phone made in bannana."
"2021/01/23 7:53:35 午後 GMT+9","同意する (I Agree)","C1","Chinese","A man is riding a bike with people watching on the other side of the fence.","Someone is trying to learn skiing on the snow field.","A train went through the woods on a sunny day.","The elephant kisses the man with its long trunk.","The little girl is holding a baseball bat, smiling.","A lot of fruits are displayed in baskets at the market.","A man is holding the ropes to a giant kite on the beach.","A dog is resting its head on the bow of a ship.","A boy is playing a video game while holding the remote in his hand.","The telephone has its receiver replaced by a banana."
"2021/01/25 12:20:28 午後 GMT+9","同意する (I Agree)","B1","Japanese","The motorcycle which a man ride is white and green.","The girl who wears blue jacket and red pants is learning ski.","The green train in rural goes to the next destination.","A big elephant kissed a man's cheek and he laughed.","The smiling girl is holding baseball bat with her left hand neat the hut. ","People come here to buy the colorful fruits which are displayed.","A man pulls the parachute and a woman holds it.","A dog rests on the boat and look at the sea.","The boy who plays game is holding controller with his right hand.","A part of the black telephone is replaced a banana."
"2021/01/25 9:05:55 午後 GMT+9","同意する (I Agree)","C1","German","A person is riding a motorbike while spectators a watching her passing by. ","A teenager or child is learning to ski by improving its balance ability. ","A train goes by while the photographer stands still. ","It seems that an Elefant kisses a man who is enjoying it tremendously. ","A young girl tries to hold her smile while holding a baseball bat ","A vegetable seller displays his apples arranged by color ","A man holds a kite while a woman takes a look at the kite ","A German shepherd dog takes a rest but has her eyes wide open ","A young boy holds a controller in the hand to play a video game with movement functionality ","The headphone was replaced by a banana and the headphone is hidden behind the telephone"
"2021/01/27 3:51:08 午後 GMT+9","同意する (I Agree)","B2","Japanese","The man who wear the white helmet ride the white bike.","The girl is learning how to play skiing","There is the green train going to the station.","The ehephant is kissing to the man's neck.","The girl holding the bat is smiling with putting her hand on her mouce.","There are a number of apples displayed.","The man is preparing the parachute and the women is holding it.","There is the dog resting its head on the ship.","The boy holding the remote controler is playing the game of Nintendo Wii Sport's bowling.","A part of the phone is replaced with the banana."
"2021/02/01 11:45:30 午前 GMT+9","同意する (I Agree)","B1","Japanese","A man ride a bike on the road.","A guy is learning a a ski.","The trains go down the hill.","The black animal will kill a man by kissing him.","A girl holding a bat smile.","Many, many , many, displayed flustu ","The two men hold something such a kite.","A dog rest .","A guy is playing a game holding a controller.","A banana is replaced picker."